"author","title","journal","abstract","doi","ID","database","status"
"Tourlomousis, F. and Chang, R.C.","Numerical investigation of dynamic microorgan devices as drug screening platforms. Part I: Macroscale modeling approach & validation","Biotechnology and Bioengineering","The dynamic nature of in vitro drug metabolism models demands reliable numerical tools to determine key design parameter values towards high-fidelity cell-based platforms of in vivo drug metabolism. This paper represents the first of a two-part model-based investigation of a 3D dynamic microorgan device (DMD). The prescribed tissue model in this paper is precisely embedded within a DMD by 3D bioprinting hydrogel encapsulated liver cells into a patterned array of microchannels. A perfusing drug substrate is biotransformed by liver cells encapsulated within porous hydrogel walls. Therefore, the free and porous flow regime equations are first solved in tandem to derive the laminar velocity profile and wall shear stresses in the entire shear-mediated flow regime. These equations are then coupled with a convection-diffusion equation and Michaelis-Menten reaction terms, resulting in an effective convection-diffusion-cell kinetics model. A key consideration addressed herein is mechanotransduction where shear stresses on the encapsulated cells alter subcellular liver enzyme reaction rates. Cells are incorporated into the geometric model implicitly (macroscale) as enzyme reaction structures uniformly distributed throughout the DMD length. Transient simulations enable effluent drug metabolite profile determination wherein the proposed macroscale modeling approach is validated with an experimental drug flow study.  2016 Wiley Periodicals, Inc.","10.1002/bit.25822",2105,"Scopus","u"
"Tourlomousis, F. and Chang, R.C.","Numerical investigation of dynamic microorgan devices as drug screening platforms. Part II: Microscale modeling approach and validation","Biotechnology and Bioengineering","The authors have previously reported a rigorous macroscale modeling approach for an in vitro 3D dynamic microorgan device (DMD). This paper represents the second of a two-part model-based investigation where the effect of microscale (single liver cell-level) shear-mediated mechanotransduction on drug biotransformation is deconstructed. Herein, each cell is explicitly incorporated into the geometric model as single compartmentalized metabolic structures. Each cell's metabolic activity is coupled with the microscale hydrodynamic Wall Shear Stress (WSS) simulated around the cell boundary through a semi-empirical polynomial function as an additional reaction term in the mass transfer equations. Guided by the macroscale model-based hydrodynamics, only 9 cells in 3 representative DMD domains are explicitly modeled. Dynamic and reaction similarity rules based on non-dimensionalization are invoked to correlate the numerical and empirical models, accounting for the substrate time scales. The proposed modeling approach addresses the key challenge of computational cost towards modeling complex large-scale DMD-type system with prohibitively high cell densities. Transient simulations are implemented to extract the drug metabolite profile with the microscale modeling approach validated with an experimental drug flow study. The results from the author's study demonstrate the preferred implementation of the microscale modeling approach over that of its macroscale counterpart. Biotechnol. Bioeng. 2016;113: 623-634.  2015 Wiley Periodicals, Inc. A) Microscale modeling approach concept schematic, where only 9 encapsulated cells are modeled explicitly as voids at three DMD regimes along the length of the hydrogel-based microchannel wall. B) Hydrodynamics are characterized through WSS contour maps for a prescribed drug flow study. C) Mass transfer and Pharmacokinetics are characterized through species concentration contour maps. D) This yields a cell kinetics-convection-diffusion model that allows the prediction of the metabolite concentration profile at the DMD outlet with and without the mechanotransduction effect included.  2016 Wiley Periodicals, Inc.","10.1002/bit.25824",2109,"Scopus","u"
"van de Stolpe, Anja","On the origin and destination of cancer stem cells: a conceptual evaluation","AMERICAN JOURNAL OF CANCER RESEARCH","Despite remaining uncertainties and ongoing research it is possible to draw up a model for the role of (cancer) stem cells in both the initiation and progression of cancer towards metastasis. The cancer stem cell of origin and the cancer stem cell are, despite phenotypic similarities, genotypically different entities. Given the right circumstances provided by a combination of genomic changes and biochemical and physical interactions with its microenvironment, an epithelial cancer cell may undergo a phenotypic epithelial mesenchymal transition (EMT) towards a cancer stem cell. This transition conveys upon the cell crucial stem cell-like abilities which facilitate migration into the blood circulation as an individual circulating tumor cell, survive there, and subsequently seed into organ tissue where, once more in close interaction with its microenvironment, the process of clonal self renewal may start, leading to a metastatic tumor. Both in the primary tumor as well as in the metastatic tumor, partial differentiation of the cancer stem cell progeny leads to phenotypic heterogeneity. Throughout this complex process of cancer metastasis similarities with the way stem cells function during embryonic development, including the signaling pathways that mediate these functions, are evident. Deeper insight in the EMT process, plasticity of the resulting cancer stem cells, and the role of cancer stem cells in the metastatic process is expected to lead to novel anti-metastatic cancer therapies. Emerging human in vitro cancer models in the form of ``organ-on-a-chip{''} may contribute valuable novel research tools to achieve this aim.",NA,3354,"Web of Science","r"
"van de Stolpe A.","On the origin and destination of cancer stem cells: A conceptual evaluation","Am. J. Cancer Res","Despite remaining uncertainties and ongoing research it is possible to draw up a model for the role of (cancer) stem cells in both the initiation and progression of cancer towards metastasis. The cancer stem cell of origin and the cancer stem cell are, despite phenotypic similarities, genotypically different entities. Given the right circumstances provided by a combination of genomic changes and biochemical and physical interactions with its microenvironment, an epithelial cancer cell may undergo a phenotypic epithelial mesenchymal transition (EMT) towards a cancer stem cell. This transition conveys upon the cell crucial stem cell-like abilities which facilitate migration into the blood circulation as an individual circulating tumor cell, survive there, and subsequently seed into organ tissue where, once more in close interaction with its microenvironment, the process of clonal self renewal may start, leading to a metastatic tumor. Both in the primary tumor as well as in the metastatic tumor, partial differentiation of the cancer stem cell progeny leads to phenotypic heterogeneity. Throughout this complex process of cancer metastasis similarities with the way stem cells function during embryonic development, including the signaling pathways that mediate these functions, are evident. Deeper insight in the EMT process, plasticity of the resulting cancer stem cells, and the role of cancer stem cells in the metastatic process is expected to lead to novel anti-metastatic cancer therapies. Emerging human in vitro cancer models in the form of ""organ-on-a-chip"" may contribute valuable novel research tools to achieve this aim.",NA,2056,"EMBASE","r"
"van de Stolpe A","On the origin and destination of cancer stem cells: a conceptual evaluation.","American journal of cancer research","Despite remaining uncertainties and ongoing research it is possible to draw up a model for the role of (cancer) stem cells in both the initiation and progression of cancer towards metastasis. The cancer stem cell of origin and the cancer stem cell are, despite phenotypic similarities, genotypically different entities. Given the right circumstances provided by a combination of genomic changes and biochemical and physical interactions with its microenvironment, an epithelial cancer cell may undergo a phenotypic epithelial mesenchymal transition (EMT) towards a cancer stem cell. This transition conveys upon the cell crucial stem cell-like abilities which facilitate migration into the blood circulation as an individual circulating tumor cell, survive there, and subsequently seed into organ tissue where, once more in close interaction with its microenvironment, the process of clonal self renewal may start, leading to a metastatic tumor. Both in the primary tumor as well as in the metastatic tumor, partial differentiation of the cancer stem cell progeny leads to phenotypic heterogeneity. Throughout this complex process of cancer metastasis similarities with the way stem cells function during embryonic development, including the signaling pathways that mediate these functions, are evident. Deeper insight in the EMT process, plasticity of the resulting cancer stem cells, and the role of cancer stem cells in the metastatic process is expected to lead to novel anti-metastatic cancer therapies. Emerging human in vitro cancer models in the form of ""organ-on-a-chip"" may contribute valuable novel research tools to achieve this aim.",NA,2129,"PubMed","k"
"Wang, Z. and Samanipour, R. and Koo, K.-I. and Kim, K.","Organ-on-a-chip platforms for drug delivery and cell characterization: A review","Sensors and Materials","Developments in micro- and nanofluidic technologies have led to new kinds of cell culture and screening systems that are collectively termed organ-on-a-chip systems. Organ-on-a-chip systems are in vitro microfabricated devices that mimic dynamic interactions of in vivo microenvironments. In addition to existing two-dimensional and three-dimensional tissues, organ-on-a-chip systems can mimic the biomechanical and biochemical microenvironments of in vivo tissues as well as the interactional effects of the microenvironments on cell and tissue functions. Owing to those features, organ-ona-chip systems have become excellent platforms for drug screening and delivery tests. In this review, specific examples of organ-on-a-chip devices and their applications in tissue engineering and drug delivery tests are presented. The utility and performance of stateof-the-art organ-on-a-chip systems, including lung-on-a-chip, heart-on-a-chip, vessel-ona-chip, liver-on-a-chip, and tumor-on-a-chip, are also covered in this review. Limitations of conventional systems, basic fabrication processes for organ-on-a-chip devices, and future prospects of organ-on-a-chip systems are discussed.  MYU K.K.","10.18494/sam.2015.1086",2997,"Scopus","k"
"Wang, Zongjie and Samanipour, Roya and Koo, Kyo-in and Kim, Keekyoung","Organ-on-a-Chip Platforms for Drug Delivery and Cell Characterization: A Review","SENSORS AND MATERIALS","Developments in micro- and nanofluidic technologies have led to new kinds of cell culture and screening systems that are collectively termed organ-on-a-chip systems. Organ-on-a-chip systems are in vitro microfabricated devices that mimic dynamic interactions of in vivo microenvironments. In addition to existing two-dimensional and three-dimensional tissues, organ-on-a-chip systems can mimic the biomechanical and biochemical microenvironments of in vivo tissues as well as the interactional effects of the microenvironments on cell and tissue functions. Owing to those features, organ-on-a-chip systems have become excellent platforms for drug screening and delivery tests. In this review, specific examples of organ-on-a-chip devices and their applications in tissue engineering and drug delivery tests are presented. The utility and performance of state-of-the-art organ-on-a-chip systems, including lung-on-a-chip, heart-on-a-chip, vessel-on-a-chip, liver-on-a-chip, and tumor-on-a-chip, are also covered in this review. Limitations of conventional systems, basic fabrication processes for organ-on-a-chip devices, and future prospects of organ-on-a-chip systems are discussed.",NA,3340,"Web of Science","r"
"An, Fan and Qu, Yueyang and Liu, Xianming and Zhong, Runtao and Luo, Yong","Organ-on-a-Chip: New Platform for Biological Analysis","ANALYTICAL CHEMISTRY INSIGHTS","Direct detection and analysis of biomolecules and cells in physiological microenvironment is urgently needed for fast evaluation of biology and pharmacy. The past several years have witnessed remarkable development opportunities in vitro organs and tissues models with multiple functions based on microfluidic devices, termed as ``organ-on-a-chip{''}. Briefly speaking, it is a promising technology in rebuilding physiological functions of tissues and organs, featuring mammalian cell co-culture and artificial microenvironment created by microchannel networks. In this review, we summarized the advances in studies of heart-, vessel-, liver-, neuron-, kidney- and Multi-organs-on-a-chip, and discussed some noteworthy potential on-chip detection schemes.","10.4137/acici.s28905",3308,"Web of Science","r"
"An F and Qu Y and Liu X and Zhong R and Luo Y","Organ-on-a-Chip: New Platform for Biological Analysis.","Analytical chemistry insights","Direct detection and analysis of biomolecules and cells in physiological microenvironment is urgently needed for fast evaluation of biology and pharmacy. The past several years have witnessed remarkable development opportunities in vitro organs and tissues models with multiple functions based on microfluidic devices, termed as ""organ-on-a-chip"". Briefly speaking, it is a promising technology in rebuilding physiological functions of tissues and organs, featuring mammalian cell co-culture and artificial microenvironment created by microchannel networks. In this review, we summarized the advances in studies of heart-, vessel-, liver-, neuron-, kidney- and Multi-organs-on-a-chip, and discussed some noteworthy potential on-chip detection schemes.","10.4137/aci.s28905",2643,"PubMed","k"
"Maschmeyer I and Kakava S","Organ-on-a-Chip.","Advances in biochemical engineering/biotechnology","Limitations of the current tools used in the drug development process, cell cultures, and animal models have highlighted the need for a new powerful tool that can emulate the human physiology in vitro. Advances in the field of microfluidics have made the realization of this tool closer than ever. Organ-on-a-chip platforms have been the first step forward, leading to the combination and integration of multiple organ models in the same platform with human-on-a-chip being the ultimate goal. Despite the current progress and technological developments, there are still several unmet engineering and biological challenges curtailing their development and widespread application in the biomedical field. The potentials, challenges, and current work on this unprecedented tool are being discussed in this chapter.","10.1007/10_2020_135",169,"PubMed","u"
"Park SE and Georgescu A and Huh D","Organoids-on-a-chip.","Science (New York, N.Y.)","Recent studies have demonstrated an array of stem cell-derived, self-organizing miniature organs, termed organoids, that replicate the key structural and functional characteristics of their in vivo counterparts. As organoid technology opens up new frontiers of research in biomedicine, there is an emerging need for innovative engineering approaches for the production, control, and analysis of organoids and their microenvironment. In this Review, we explore organ-on-a-chip technology as a platform to fulfill this need and examine how this technology may be leveraged to address major technical challenges in organoid research. We also discuss emerging opportunities and future obstacles for the development and application of organoid-on-a-chip technology.","10.1126/science.aaw7894",1813,"PubMed","u"
"Low, Lucie A. and Sutherland, Margaret and Lumelsky, Nadya and Selimovic, Seila and Lundberg, Martha S. and Tagle, Danilo A.","Organs-on-a-Chip",NA,"Organs-on-chips, also known as ``tissue chips{''} or microphysiological systems (MPS), are bioengineered microsystems capable of recreating aspects of human organ physiology and function and are in vitro tools with multiple applications in drug discovery and development. The ability to recapitulate human and animal tissues in physiologically relevant three-dimensional, multi-cellular environments allows applications in the drug development field, including; (1) use in assessing the safety and toxicity testing of potential therapeutics during early-stage preclinical drug development; (2) confirmation of drug/therapeutic efficacy in vitro; and (3) disease modeling of human tissues to recapitulate pathophysiology within specific subpopulations and even individuals, thereby advancing precision medicine efforts. This chapter will discuss the development and evolution of three-dimensional organ models over the past decade, and some of the opportunities offered by MPS technology that are not available through current standard two-dimensional cell cultures, or three-dimensional organoid systems. This chapter will outline future avenues of research in the MPS field, how cutting-edge biotechnology advances are expanding the applications for these systems, and discuss the current and future potential and challenges remaining for the field to address.","10.1007/978-3-030-36588-2\_3",3318,"Web of Science","r"
"Moraes C. and Mehta G. and Lesher-Perez S.C. and Takayama S.","Organs-on-a-chip: a focus on compartmentalized microdevices","Ann Biomed Eng","Advances in microengineering technologies have enabled a variety of insights into biomedical sciences that would not have been possible with conventional techniques. Engineering microenvironments that simulate in vivo organ systems may provide critical insight into the cellular basis for pathophysiologies, development, and homeostasis in various organs, while curtailing the high experimental costs and complexities associated with in vivo studies. In this article, we aim to survey recent attempts to extend tissue-engineered platforms toward simulating organ structure and function, and discuss the various approaches and technologies utilized in these systems. We specifically focus on microtechnologies that exploit phenomena associated with compartmentalization to create model culture systems that better represent the in vivo organ microenvironment.",NA,1370,"EMBASE","k"
"Moraes, C. and Mehta, G. and Lesher-Perez, S.C. and Takayama, S.","Organs-on-a-Chip: A focus on compartmentalized microdevices","Annals of Biomedical Engineering","Advances in microengineering technologies have enabled a variety of insights into biomedical sciences that would not have been possible with conventional techniques. Engineering microenvironments that simulate in vivo organ systems may provide critical insight into the cellular basis for pathophysiologies, development, and homeostasis in various organs, while curtailing the high experimental costs and complexities associated with in vivo studies. In this article, we aim to survey recent attempts to extend tissue-engineered platforms toward simulating organ structure and function, and discuss the various approaches and technologies utilized in these systems. We specifically focus on microtechnologies that exploit phenomena associated with compartmentalization to create model culture systems that better represent the in vivo organ microenvironment.  2011 Biomedical Engineering Society.","10.1007/s10439-011-0455-6",2115,"Scopus","r"
"Moyer MW","Organs-on-a-Chip.","Scientific American",NA,"10.1038/scientificamerican0311-19a",2097,"PubMed","u"
"Low LA and Sutherland M and Lumelsky N and Selimovic S and Lundberg MS and Tagle DA","Organs-on-a-Chip.","Advances in experimental medicine and biology","Organs-on-chips, also known as ""tissue chips"" or microphysiological systems (MPS), are bioengineered microsystems capable of recreating aspects of human organ physiology and function and are in vitro tools with multiple applications in drug discovery and development. The ability to recapitulate human and animal tissues in physiologically relevant three-dimensional, multi-cellular environments allows applications in the drug development field, including; (1) use in assessing the safety and toxicity testing of potential therapeutics during early-stage preclinical drug development; (2) confirmation of drug/therapeutic efficacy in vitro; and (3) disease modeling of human tissues to recapitulate pathophysiology within specific subpopulations and even individuals, thereby advancing precision medicine efforts. This chapter will discuss the development and evolution of three-dimensional organ models over the past decade, and some of the opportunities offered by MPS technology that are not available through current standard two-dimensional cell cultures, or three-dimensional organoid systems. This chapter will outline future avenues of research in the MPS field, how cutting-edge biotechnology advances are expanding the applications for these systems, and discuss the current and future potential and challenges remaining for the field to address.","10.1007/978-3-030-36588-2_3",2848,"PubMed","k"
"Saha B. and Mathur T. and Handley K.F. and Hu W. and Afshar-Kharghan V. and Sood A.K. and Jain A.","OvCa-Chip microsystem recreates vascular endothelium-mediated platelet extravasation in ovarian cancer","Blood Adv","In ovarian cancer, platelet extravasation into the tumor and resulting metastasis is thought to be regulated mostly by the vascular endothelium. Because it is difficult to dissect complex underlying events in murine models, organ-on-a-chip methodology is applied to model vascular and platelet functions in ovarian cancer. This system (OvCa-Chip) consists of microfluidic chambers that are lined by human ovarian tumor cells interfaced with a 3-dimensional endothelialized lumen. Subsequent perfusion with human platelets within the device's vascular endothelial compartment under microvascular shear conditions for 5 days uncovered organ-to-molecular-level contributions of the endothelium to triggering platelet extravasation into tumors. Further, analysis of effluents available from the device's individual tumor and endothelial chambers revealed temporal dynamics of vascular disintegration caused by cancer cells, a differential increase in cytokine expression, and an alteration of barrier maintenance genes in endothelial cells. These events, when analyzed within the device over time, made the vascular tissue leaky and promoted platelet extravasation. Atorvastatin treatment of the endothelial cells within the OvCa-Chip revealed improved endothelial barrier function, reduction in inflammatory cytokines and, eventually, arrest of platelet extravasation. These data were validated through corresponding observations in patient-derived tumor samples. The OvCa-Chip provides a novel in vitro dissectible platform to model the mechanisms of the cancer-vascular-hematology nexus and the analyses of potential therapeutics.","10.1182/bloodadvances.2020001632dummy2",680,"EMBASE","r"
"Saha B and Mathur T and Handley KF and Hu W and Afshar-Kharghan V and Sood AK and Jain A","OvCa-Chip microsystem recreates vascular endothelium-mediated platelet extravasation in ovarian cancer.","Blood advances","In ovarian cancer, platelet extravasation into the tumor and resulting metastasis is thought to be regulated mostly by the vascular endothelium. Because it is difficult to dissect complex underlying events in murine models, organ-on-a-chip methodology is applied to model vascular and platelet functions in ovarian cancer. This system (OvCa-Chip) consists of microfluidic chambers that are lined by human ovarian tumor cells interfaced with a 3-dimensional endothelialized lumen. Subsequent perfusion with human platelets within the device's vascular endothelial compartment under microvascular shear conditions for 5 days uncovered organ-to-molecular-level contributions of the endothelium to triggering platelet extravasation into tumors. Further, analysis of effluents available from the device's individual tumor and endothelial chambers revealed temporal dynamics of vascular disintegration caused by cancer cells, a differential increase in cytokine expression, and an alteration of barrier maintenance genes in endothelial cells. These events, when analyzed within the device over time, made the vascular tissue leaky and promoted platelet extravasation. Atorvastatin treatment of the endothelial cells within the OvCa-Chip revealed improved endothelial barrier function, reduction in inflammatory cytokines and, eventually, arrest of platelet extravasation. These data were validated through corresponding observations in patient-derived tumor samples. The OvCa-Chip provides a novel in vitro dissectible platform to model the mechanisms of the cancer-vascular-hematology nexus and the analyses of potential therapeutics.","10.1182/bloodadvances.2020001632",684,"PubMed","k"
