"author","title","journal","abstract","doi","ID","database","status"
"Ingber, D.","'Organ-on-a-chip' technology: On trial","Chemistry and Industry (London)",NA,NA,3188,"Scopus","k"
"Ingber, Don","`Organ-on-a-chip' technology: on trial","CHEMISTRY \& INDUSTRY",NA,NA,3320,"Web of Science","r"
"Vurat, Murat Taner and Ergun, Can and Elcin, Ayse Eser and Elcin, Yasar Murat","3D Bioprinting of Tissue Models with Customized Bioinks",NA,"The ordered assembly of multicellular structures mimicking native tissues has lately come into prominence for various applications of biomedicine. In this respect, three-dimensional bioprinting (3DP) of cells and other biologics through additive manufacturing techniques has brought the possibility to develop functional in vitro tissue models and perhaps creating de novo transplantable tissues or organs in time. Bioinks, which can be defined as the printable analogues of the extracellular matrix, represent the foremost component of 3DP. In this chapter, we attempt to elaborate the major classes of bioinks which are prevalently being evaluated for the 3DP of a wide range of tissue models.","10.1007/978-981-15-3258-0\_5",3314,"Web of Science","r"
"Vurat MT and Ergun C and Elin AE and Elin YM","3D Bioprinting of Tissue Models with Customized Bioinks.","Advances in experimental medicine and biology","The ordered assembly of multicellular structures mimicking native tissues has lately come into prominence for various applications of biomedicine. In this respect, three-dimensional bioprinting (3DP) of cells and other biologics through additive manufacturing techniques has brought the possibility to develop functional in vitro tissue models and perhaps creating de novo transplantable tissues or organs in time. Bioinks, which can be defined as the printable analogues of the extracellular matrix, represent the foremost component of 3DP. In this chapter, we attempt to elaborate the major classes of bioinks which are prevalently being evaluated for the 3DP of a wide range of tissue models.","10.1007/978-981-15-3258-0_5",3977,"PubMed","k"
"Poussin, C. and Kramer, B. and Lanz, H.L. and van den Heuvel, A. and Laurent, A. and Olivier, T. and Vermeer, M. and Peric, D. and Baumer, K. and Dulize, R. and Guedj, E. and Ivanov, N.V. and Peitsch, M.C. and Hoeng, J. and Joore, J.","3D human microvessel-on-a-chip model for studying monocyte-to-endothelium adhesion under flow - Application in systems toxicology","Altex","Lifestyle and genetic factors can lead to the development of atherosclerosis and, ultimately, cardiovascular adverse events. Rodent models are commonly used to investigate mechanism(s) of atherogenesis. However, the 3R principles, aiming to limit animal testing, encourage the scientific community to develop new, physiologically relevant alternatives. Leveraging the 96-chip OrganoPlate, a microfluidic platform, we have established a three-dimensional (3D) model of endothelial microvessels-on-a-chip under flow using primary human coronary arterial endothelial cells. As functional readout, we have set up an assay to measure the adhesion of monocytes to the lumen of perfused microvessels. For monitoring molecular changes in microvessels, we have established the staining and quantification of specific protein markers of inflammation and oxidative stress using high-content imaging as well as analyzed transcriptome changes using microarrays. To demonstrate its usefulness in systems toxicology, we used our 3D vasculature-on-a-chip model to assess the impact of the Tobacco Heating System (THS) 2.2, a candidate modified-risk tobacco product, and the 3R4F reference cigarette on the adhesion of monocytic cells to endothelial microvessels. Our results show that THS 2.2 aerosol-conditioned medium had a reduced effect on monocyte-endothelial adhesion compared with that of 3R4F smoke-conditioned medium. In conclusion, we have established a relevant 3D vasculature-on-a-chip model for investigating leukocyte-endothelial microvessel adhesion. A case study illustrates how the model can be used for product testing in the context of systems toxicology-based risk assessment. The current model and its potential further development options also open perspectives of applications in vascular disease research and drug discovery.  The Authors, 2019. funding_text 1={Philip Morris International is the sole source of funding and sponsor of this research. We thank Pauline Betsch and Dr Remko van Vught for project management support, Didier Goedertier and Claudius Pak for generating the aqueous smoke/aerosol extracts, Dr Alain Sewer for preparing and submitting transcriptomics data to the Array Express repository database, Dr Stphanie Bou for preparing and publishing the study data in INTERVALS (https://www.intervals.science/), and Frederik Schavemaker for support with schematic illustrations. We also thank Dr Dean Meyer from Edanz Medical Writing (https://www.edanzediting.com/ac) for editing a draft of this manuscript.","10.14573/altex.1811301s",3093,"Scopus","r"
"Poussin C and Kramer B and Lanz HL and Van den Heuvel A and Laurent A and Olivier T and Vermeer M and Peric D and Baumer K and Dulize R and Guedj E and Ivanov NV and Peitsch MC and Hoeng J and Joore J","3D human microvessel-on-a-chip model for studying monocyte-to-endothelium adhesion under flow - application in systems toxicology.","ALTEX","Lifestyle and genetic factors can lead to the development of atherosclerosis and, ultimately, cardiovascular adverse events. Rodent models are commonly used to investigate mechanism(s) of atherogenesis. However, the 3Rs principles, aiming to limit animal testing, encourage the scientific community to develop new physiologically relevant in vitro alternatives. Leveraging the 96-chip OrganoPlate, a microfluidic platform, we have established a three-dimensional (3D) model of endothelial microvessels-on-a-chip under flow using primary human coronary arterial endothelial cells. As functional readout, we have set up an assay to measure the adhesion of monocytes to the lumen of perfused microvessels. For monitoring molecular changes in microvessels, we have established the staining and quantification of specific protein markers of inflammation and oxidative stress using high content imaging, as well as analyzed transcriptome changes using microarrays. To demonstrate its usefulness in systems toxicology, we leveraged our 3D vasculature-on-a-chip model to assess the impact of the Tobacco Heating System (THS) 2.2, a candidate modified risk tobacco product, and the 3R4F reference cigarette on the adhesion of monocytic cells to endothelial microvessels. Our results show that THS 2.2 aerosol-conditioned medium had a reduced effect on monocyte-endothelium adhesion compared with 3R4F smoke-conditioned medium. In conclusion, we have established a relevant 3D vasculature-on-a-chip model for investigating leukocyte-endothelial microvessel adhesion. A case study illustrates how the model can be used for product testing in the context of systems toxicology-based risk assessment. The current model and its potential further development options also open perspectives of applications in vascular disease research and drug discovery.","10.14573/altex.1811301",698,"PubMed","k"
"Hosseinkhani H.","3D in vitro technology for drug discovery","Curr Drug Saf","Three-dimensional (3D) in vitro systems that can mimic organ and tissue structure and function in vivo, will be of great benefit for a variety of biological applications from basic biology to toxicity testing and drug discovery. There have been several attempts to generate 3D tissue models but most of these models require costly equipment, and the most serious disadvantage in them is that they are too far from the mature human organs in vivo. Because of these problems, research and development in drug discovery, toxicity testing and biotech industries are highly expensive, and involve sacrifice of countless animals and it takes several years to bring a single drug/product to the market or to find the toxicity or otherwise of chemical entities. Our group has been actively working on several alternative models by merging biomaterials science, nanotechnology and biological principles to generate 3D in vitro living organs, to be called ""Human Organs-on-Chip"", to mimic natural organ/tissues, in order to reduce animal testing and clinical trials. We have fabricated a novel type of mechanically and biologically bio-mimicking collagen-based hydrogel that would provide for interconnected mini-wells in which 3D cell/organ culture of human samples in a manner similar to human organs with extracellular matrix (ECM) molecules would be possible. These products mimic the physical, chemical, and biological properties of natural organs and tissues at different scales. This paper will review the outcome of our several experiments so far in this direction and the future perspectives.",NA,1368,"EMBASE","r"
"Hosseinkhani, H.","3D in vitro technology for drug discovery","Current Drug Safety","Three-dimensional (3D) in vitro systems that can mimic organ and tissue structure and function in vivo, will be of great benefit for a variety of biological applications from basic biology to toxicity testing and drug discovery. There have been several attempts to generate 3D tissue models but most of these models require costly equipment, and the most serious disadvantage in them is that they are too far from the mature human organs in vivo. Because of these problems, research and development in drug discovery, toxicity testing and biotech industries are highly expensive, and involve sacrifice of countless animals and it takes several years to bring a single drug/product to the market or to find the toxicity or otherwise of chemical entities. Our group has been actively working on several alternative models by merging biomaterials science, nanotechnology and biological principles to generate 3D in vitro living organs, to be called ""Human Organs-on-Chip"", to mimic natural organ/tissues, in order to reduce animal testing and clinical trials. We have fabricated a novel type of mechanically and biologically bio-mimicking collagen-based hydrogel that would provide for interconnected mini-wells in which 3D cell/organ culture of human samples in a manner similar to human organs with extracellular matrix (ECM) molecules would be possible. These products mimic the physical, chemical, and biological properties of natural organs and tissues at different scales. This paper will review the outcome of our several experiments so far in this direction and the future perspectives.  2012 Bentham Science Publishers.","10.2174/157488612800492753",2072,"Scopus","k"
"Yamamoto, Chika and Takemura, Akinori and Ishii, Sanae and Doi, Atsushi and Saito, Isao and Yamada, Hideki and Sakai, Yoko and Matsunaga, Tamihide and Ito, Kousei","A novel perfusion culture system for screening mitochondria) toxicity in primary mouse hepatocytes","JOURNAL OF TOXICOLOGICAL SCIENCES","The liver microphysiological system (MPS) model is an in-vitro culture method that mimics physiological blood flow, which enhances basal cellular functions. However, the liver MPS model has not been tested in the preclinical stage because of its obscure utility. It can overcome the major problem of conventional systems -rapid loss of mitochondrial activity in cultured hepatocytes due to limited oxygen supply by supplying oxygen to cultured hepatocytes using a perfusion device. In this study, we developed a new perfusion culture system that can detect mitochondrial toxicity. Primary mouse hepatocytes were cultured under perfusion condition for 48 hr. The hepatocytes showed increased oxygen consumption and reduced lactate release. These results indicated that the ATP-production pathway was switched from glycolysis to mitochondrial oxidative phosphorylation in the perfusion culture system. Furthermore, ATP levels were considerably reduced in the perfusion culture system after exposure to phenformin, a mitochondrial complex I inhibitor. To summarize, the perfusion culture system could improve the mitochondrial activity in primary mouse hepatocytes, and thus, has potential implications in the detection of mitochondrial toxicity.",NA,4054,"Web of Science","r"
"Yamamoto C. and Takemura A. and Ishii S. and Doi A. and Saito I. and Yamada H. and Sakai Y. and Matsunaga T. and Ito K.","A novel perfusion culture system for screening mitochondrial toxicity in primary mouse hepatocytes","J. Toxicol. Sci","- The liver microphysiological system (MPS) model is an in-vitro culture method that mimics physiological blood flow, which enhances basal cellular functions. However, the liver MPS model has not been tested in the preclinical stage because of its obscure utility. It can overcome the major prob-lem of conventional systems-rapid loss of mitochondrial activity in cultured hepatocytes due to limited oxygen supply-by supplying oxygen to cultured hepatocytes using a perfusion device. In this study, we developed a new perfusion culture system that can detect mitochondrial toxicity. Primary mouse hepat-ocytes were cultured under perfusion condition for 48 hr. The hepatocytes showed increased oxygen consumption and reduced lactate release. These results indicated that the ATP-production pathway was switched from glycolysis to mitochondrial oxidative phosphorylation in the perfusion culture system. Fur-thermore, ATP levels were considerably reduced in the perfusion culture system after exposure to phen-formin, a mitochondrial complex I inhibitor. To summarize, the perfusion culture system could improve the mitochondrial activity in primary mouse hepatocytes, and thus, has potential implications in the detec-tion of mitochondrial toxicity.","10.2131/jts.47.13",3400,"EMBASE","k"
"Salehi, S. and Tran, K. and Grayson, W.L.","Advances in perfusion systems for solid organ preservation","Yale Journal of Biology and Medicine","In the past, a diagnosis of organ failure would essentially be a death sentence for patients. With improved techniques for organ procurement and surgical procedures, transplantations to treat organ failure have become standard medical practice. However, while the demand for organs has skyrocketed, the donor pool has not kept pace leading to long recipient waiting lists. Organ preservation provides a means to increase the number of available transplantable organs. However, there are significant drawbacks associated with cold storage, the current gold standard. To address the short-comings due to diffusional limitations, engineers have developed cold perfusion systems. More recently, there has been a significant trend towards the development of near-normothermic systems to enhance the functional preservation of solid organs including livers, lungs, hearts, kidneys, and vascularized composite allotransplants. Here we review recent advances in the development of perfusion systems for the preservation of solid organs. We provide a brief history of organ transplantation, the limitations of existing systems, and describe research being done to develop commercially available perfusion systems to enhance organ preservation.  2018, Yale Journal of Biology and Medicine Inc. All rights reserved.",NA,3211,"Scopus","r"
"Salehi S and Tran K and Grayson WL","Advances in Perfusion Systems for Solid Organ Preservation.","The Yale journal of biology and medicine","In the past, a diagnosis of organ failure would essentially be a death sentence for patients. With improved techniques for organ procurement and surgical procedures, transplantations to treat organ failure have become standard medical practice. However, while the demand for organs has skyrocketed, the donor pool has not kept pace leading to long recipient waiting lists. Organ preservation provides a means to increase the number of available transplantable organs. However, there are significant drawbacks associated with cold storage, the current gold standard. To address the short-comings due to diffusional limitations, engineers have developed cold perfusion systems. More recently, there has been a significant trend towards the development of near-normothermic systems to enhance the functional preservation of solid organs including livers, lungs, hearts, kidneys, and vascularized composite allotransplants. Here we review recent advances in the development of perfusion systems for the preservation of solid organs. We provide a brief history of organ transplantation, the limitations of existing systems, and describe research being done to develop commercially available perfusion systems to enhance organ preservation.",NA,2824,"PubMed","k"
"Abudupataer, Mieradilijiang and Zhu, Shichao and Yan, Shiqiang and Xu, Kehua and Zhang, Jingjing and Luo, Shaman and Ma, Wenrui and Alam, Md Fazle and Tang, Yuyi and Huang, Hui and Chen, Nan and Wang, Li and Yan, Guoquan and Li, Jun and Lai, Hao and Wang, Chunsheng and Zhu, Kai and Zhang, Weijia","Aorta smooth muscle-on-a-chip reveals impaired mitochondrial dynamics as a therapeutic target for aortic aneurysm in bicuspid aortic valve disease","ELIFE","Background: Bicuspid aortic valve (BAV) is the most common congenital cardiovascular disease in general population and is frequently associated with the development of thoracic aortic aneurysm (TAA). There is no effective strategy to intervene with TAA progression due to an incomplete understanding of the pathogenesis. Insufficiency of NOTCH1 expression is highly related to BAV-TAA, but the underlying mechanism remains to be clarified. Methods: A comparative proteomics analysis was used to explore the biological differences between non-diseased and BAV-TAA aortic tissues. A microfluidics-based aorta smooth muscle-on-a-chip model was constructed to evaluate the effect of NOTCH1 deficiency on contractile phenotype and mitochondrial dynamics of human aortic smooth muscle cells (HAoSMCs). Results: Protein analyses of human aortic tissues showed the insufficient expression of NOTCH1 and impaired mitochondrial dynamics in BAV-TAA. HAoSMCs with NOTCH1-knockdown exhibited reduced contractile phenotype and were accompanied by attenuated mitochondrial fusion. Furthermore, we identified that mitochondrial fusion activators (leflunomide and teriflunomide) or mitochondrial fission inhibitor (Mdivi-1) partially rescued the disorders of mitochondrial dynamics in HAoSMCs derived from BAV-TAA patients. Conclusions: The aorta smooth muscle-on-a-chip model simulates the human pathophysiological parameters of aorta biomechanics and provides a platform for molecular mechanism studies of aortic disease and related drug screening. This aorta smooth muscle-on-a-chip model and human tissue proteomic analysis revealed that impaired mitochondrial dynamics could be a potential therapeutic target for BAV-TAA. Funding: National Key R and D Program of China, National Natural Science Foundation of China, Shanghai Municipal Science and Technology Major Project, Shanghai Science and Technology Commission, and Shanghai Municipal Education Commission. eLife digest To function properly, the heart must remain a one-way system, pumping out oxygenated blood into the aorta - the largest artery in the body - so it can be distributed across the organism. The aortic valve, which sits at the entrance of the aorta, is a key component of this system. Its three flaps (or `cusps') are pushed open when the blood exits the heart, and they shut tightly so it does not flow back in the incorrect direction. Nearly 1.4\% of people around the world are born with `bicuspid' aortic valves that only have two flaps. These valves may harden or become leaky, forcing the heart to work harder. This defect is also associated with bulges on the aorta which progressively weaken the artery, sometimes causing it to rupture. Open-heart surgery is currently the only way to treat these bulges (or `aneurysms'), as no drug exists that could slow down disease progression. This is partly because the biological processes involved in the aneurysms worsening and bursting open is unclear. Recent studies have highlighted that many individuals with bicuspid aortic valves also have lower levels of a protein known as NOTCH1, which plays a key signalling role for cells. Problems in the mitochondria - the structures that power up a cell - are also observed. However, it is not known how these findings are connected or linked with the aneurysms developing. To answer this question, Abudupataer et al. analyzed the proteins present in diseased and healthy aortic muscle cells, confirming a lower production of NOTCH1 and impaired mitochondria in diseased tissues. They also created an `aorta-on-a-chip' model where aortic muscle cells were grown in the laboratory under conditions resembling those found in the body - including the rhythmic strain that the aorta is under because of the heart beating. Abudupataer et al. then reduced NOTCH1 levels in healthy samples, which made the muscle tissue less able to contract and reduced the activity of the mitochondria. Applying drugs that tweak mitochondrial activity helped tissues from patients with bicuspid aortic valves to work better. These compounds could potentially benefit individuals with deficient aortic valves, but experiments in animals and clinical trials would be needed first to confirm the results and assess safety. The aorta-on-a-chip model developed by Abudupataer et al. also provides a platform to screen for drugs and examine the molecular mechanisms at play in aortic diseases.","10.7554/elife.69310; 10.7554/elife.69310.sa1; 10.7554/elife.69310.sa2",3335,"Web of Science","r"
"Abudupataer M and Zhu S and Yan S and Xu K and Zhang J and Luo S and Ma W and Alam MF and Tang Y and Huang H and Chen N and Wang L and Yan G and Li J and Lai H and Wang C and Zhu K and Zhang W","Aorta smooth muscle-on-a-chip reveals impaired mitochondrial dynamics as a therapeutic target for aortic aneurysm in bicuspid aortic valve disease.","eLife","BACKGROUND: Bicuspid aortic valve (BAV) is the most common congenital cardiovascular disease in general population and is frequently associated with the development of thoracic aortic aneurysm (TAA). There is no effective strategy to intervene with TAA progression due to an incomplete understanding of the pathogenesis. Insufficiency of NOTCH1 expression is highly related to BAV-TAA, but the underlying mechanism remains to be clarified. METHODS: A comparative proteomics analysis was used to explore the biological differences between non-diseased and BAV-TAA aortic tissues. A microfluidics-based aorta smooth muscle-on-a-chip model was constructed to evaluate the effect of NOTCH1 deficiency on contractile phenotype and mitochondrial dynamics of human aortic smooth muscle cells (HAoSMCs). RESULTS: Protein analyses of human aortic tissues showed the insufficient expression of NOTCH1 and impaired mitochondrial dynamics in BAV-TAA. HAoSMCs with NOTCH1-knockdown exhibited reduced contractile phenotype and were accompanied by attenuated mitochondrial fusion. Furthermore, we identified that mitochondrial fusion activators (leflunomide and teriflunomide) or mitochondrial fission inhibitor (Mdivi-1) partially rescued the disorders of mitochondrial dynamics in HAoSMCs derived from BAV-TAA patients. CONCLUSIONS: The aorta smooth muscle-on-a-chip model simulates the human pathophysiological parameters of aorta biomechanics and provides a platform for molecular mechanism studies of aortic disease and related drug screening. This aorta smooth muscle-on-a-chip model and human tissue proteomic analysis revealed that impaired mitochondrial dynamics could be a potential therapeutic target for BAV-TAA. FUNDING: National Key R and D Program of China, National Natural Science Foundation of China, Shanghai Municipal Science and Technology Major Project, Shanghai Science and Technology Commission, and Shanghai Municipal Education Commission.","10.7554/elife.69310",467,"PubMed","k"
